park,state,location,description,image
Ebey's Landing,WA,"Coupeville, WA","This stunning landscape at the gateway to Puget Sound, with its rich farmland and promising seaport, lured the earliest American pioneers north of the Columbia River to Ebey’s Landing. Today Ebey’s Landing National Historical Reserve preserves the historical, agricultural and cultural traditions of both Native and Euro-American – while offering spectacular opportunities for recreation.",/customcf/apps/CMS_HandF/ParkSearchPics/B81D7430-1DD8-B71C-0ED7826B4048F91F.jpg
Fort Vancouver,WA,"Vancouver, OR,WA","Located on the north bank of the Columbia River, in sight of snowy mountain peaks and a vibrant urban landscape, this park has a rich cultural past. From a frontier fur trading post, to a powerful military legacy, the magic of flight, and the origin of the American Pacific Northwest, history is shared at four unique sites. Discover stories of transition, settlement, conflict, and community.",/customcf/apps/CMS_HandF/ParkSearchPics/856CA6F1-1DD8-B71C-0EC7E4D8BD9CAB59.jpg
Ice Age Floods,WA,"WA,OR,ID,MT","""At the end of the last Ice Age, some 12,000 to 17,000 years ago, a series of cataclysmic floods occurred in what is now the northwest region of the United States, leaving a lasting mark of dramatic and distinguishing features on the landscape of parts of the States of Montana, Idaho, Washington and Oregon.""
Public Law 111-11, March 30, 2009",/customcf/apps/CMS_HandF/ParkSearchPics/8A78460C-155D-4519-3E65A2522D025AAF.jpg
Klondike Gold Rush - Seattle Unit,WA,"Seattle, WA","Seattle flourished during and after the Klondike Gold Rush. Merchants supplied people from around the world passing through this port city on their way to a remarkable adventure in Alaska. Today, the park is your gateway to learn about the Klondike Gold Rush, explore the area's public lands, and engage with the local community.",/customcf/apps/CMS_HandF/ParkSearchPics/5DD4D30B-155D-4519-3EE6D7F05C209D52.jpg
Lake Roosevelt,WA,"the Canadian border going to Coulee Dam along the Columbia River, WA","In 1941 the Grand Coulee Dam was built on the Columbia River as part of the Columbia River Basin project, creating a 130-mile long lake. Named for President Franklin D. Roosevelt, Lake Roosevelt National Recreation Area provides opportunities for boating, fishing, swimming, camping, canoeing, hunting and visiting historic Fort Spokane and St. Paul's Mission.",/customcf/apps/CMS_HandF/ParkSearchPics/8AD086EF-1DD8-B71C-0E04BFEC1629E0C6.jpg
Lewis & Clark,WA,"Sixteen States: IA,ID,IL,IN,KS,KY,MO,MT,NE,ND,OH,OR,PA,SD,WA,WV","The Lewis and Clark National Historic Trail is approximately 4,900 miles long, extending from Pittsburgh, Pennsylvania, to the mouth of the Columbia River, near present day Astoria, Oregon.  It follows the historic outbound and inbound routes of the Lewis and Clark Expedition as well as the preparatory section from Pittsburgh, Pennsylvania to Wood River, Illinois.",/customcf/apps/CMS_HandF/ParkSearchPics/1F2C5E30-1DD8-B71C-0ED8FE190406A09F.jpg
Lewis and Clark,WA,"Long Beach to Cannon Beach, OR,WA",Explore the timeless rainforests and majestic coastal vistas. Discover the rich heritage of the native people. Unfold the dramatic stories of America's most famous explorers. The park encompasses sites along the Columbia River and the Pacific Coast. Follow in the footsteps of the explorers and have an adventure in history.,/customcf/apps/CMS_HandF/ParkSearchPics/AB83D22C-155D-4519-3EF0C18B5B364870.jpg
Manhattan Project,WA,"Manhattan Project National Historical Park, NM,WA,TN","This site tells the story about the people, events, science, and engineering that led to the creation of the atomic bomb, which helped end World War II.",/customcf/apps/CMS_HandF/ParkSearchPics/A2FCC151-1DD8-B71C-07047AD6C96567F5.jpg
Minidoka,WA,"Jerome, ID,WA","The Pearl Harbor attack intensified existing hostility towards Japanese Americans. As wartime hysteria mounted, President Roosevelt signed Executive Order 9066 forcing over 120,000 West Coast persons of Japanese ancestry (Nikkei) to leave their homes, jobs, and lives behind, forcing them into one of ten prison camps spread across the nation because of their ethnicity.
This is Minidoka's story.",/customcf/apps/CMS_HandF/ParkSearchPics/2734B81C-1DD8-B71C-0E1C80E6C6EB149A.jpg
